{"applicability":["The original workflow requires a selected technical review checkpoint. Actual reports, finding responses and authority remain caller evidence."],"assessors":[],"dependencies":[],"effects":[],"entry":"record","exits":{"reviewed":"route"},"external_rework":{"correct":{"from":"route","port":"correction-owner"}},"id":"technical-review-recording","inputs":{},"internal_rework":[],"node_definitions":{"record":{"instructions":["New Mulgae roots use live_source v1 and project binding only; keep workspace/index unchanged through terminal completion. Terminal failure permits no rerun or compose; a fresh root needs explicit new-review-current-route authority after settlement and preserves the pending ordinal.","Use task-review for the route selected in the approved plan and the exact named Task candidate, including its goal, authorities, work commits or native source identity, changed paths, artifacts, verification evidence, and excluded state; preserve route-specific lifecycle evidence, provenance, backend checks, and finding lineage.","Review is report-only; do not edit files or start another root solely because eligible Low findings exist.","An incomplete or failed operation consumes no assessment ordinal and stops for explicit route direction without automatic fallback.","Deliver the complete aquarium.executor-handoff/v3 with original evidence, actual candidate, checks, authority and gaps. Record actual returned work and available public handles; unavailable telemetry remains unknown. Complete this ordinary Action with current fences; delivery is not Evaluator passage.","Use the review result handoff contract to collect every expected report through its actual native surface, record producer and receiver observations, and recover the same operation before considering fresh review; carry prior finding decisions and correction reasons in the Brief."],"intent":"Record the route-specific operation, evidence, completion assessment, and adjudicated findings without claiming another backend's guarantees.","items":[{"choices":["mulgae","herdr","subagent-review","waived"],"id":"review-route","prompt":"Record the effective route for this operation.","required":true,"type":"choice"},{"choices":["complete","incomplete","failed","waived"],"id":"review-operation","prompt":"Record the authoritative operation state.","required":true,"type":"choice"},{"id":"assessment-ordinal","minimum":0,"prompt":"Record zero when an incomplete or failed operation consumed no assessment, or the positive ordinal for a completed delegated review or waiver assessment.","required":true,"type":"integer"},{"accepted_outcomes":["pass","fail","inconclusive"],"help":"The declared operation is \"Verify that the completed Task review consumes exactly the next assessment ordinal for the current goal revision, uses work-unit for ordinals one through three and remediation-confirmation for ordinal four or later, and requires explicit user authority after ordinal four.\" The matching digest identifies only this abstract slot contract and does not prove that the check ran.","id":"assessment-ordinal-continuity","operation_digest":"sha256:583d4da553c2e3f7b69dc35f5c49b28333e4e38fcebc3048f5de5c49a14eb493","operation_id":"aquarium-task-review-ordinal-continuity","prompt":"Record the caller-supplied result for aquarium-task-review-ordinal-continuity; Podway does not execute or attest the operation.","required":true,"type":"check_result"},{"choices":["remediation-eligible","confirmation-only"],"id":"review-mode","prompt":"Record whether this round may trigger remediation or is confirmation-only.","required":true,"type":"choice"},{"choices":["work-unit","remediation-confirmation"],"id":"assessment-kind","prompt":"Record whether this checkpoint evaluates the named Task work unit or confirms its frozen remediation set.","required":true,"type":"choice"},{"choices":["mulgae-live-source-v1","mulgae-historical-capture","not-applicable"],"id":"review-source-contract","prompt":"Record live-source-v1 for new Mulgae execution, historical-capture for an existing captured result, or not-applicable for another route or closeout substitute.","required":true,"type":"choice"},{"id":"review-source-binding","max_length":4000,"min_length":1,"multiline":true,"prompt":"Preserve the public preflight target and digest, receipt-bound run digest, scope-derived consistency, applicable staged content binding and caller observation when available; state pending or unavailable facts explicitly. Metadata is not source content. Other routes record not-applicable.","required":true,"type":"text"},{"id":"review-evidence-reference","max_length":2000,"min_length":1,"multiline":true,"prompt":"Record bounded native lifecycle, all expected Subagent base and UI reviewer references or Herdr main and child references, production, submission and actual recipient readback when selected, preflight-failure, or waiver evidence for this checkpoint.","required":true,"type":"text"},{"choices":["pass","fail","not-provided"],"id":"backend-check-result","prompt":"Record the authoritative native backend check, or not-provided when the selected route has no backend check.","required":true,"type":"choice"},{"id":"assessment-provenance","max_length":1000,"min_length":1,"multiline":true,"prompt":"Record bounded reviewer provenance, or coordinator-waiver for an explicit waiver.","required":true,"type":"text"},{"choices":["delegated-reviewer","coordinator-waiver"],"id":"assessment-provenance-kind","prompt":"Classify whether the assessment came from a delegated reviewer or an explicit coordinator waiver.","required":true,"type":"choice"},{"id":"waiver-summary","max_length":3000,"min_length":1,"multiline":true,"prompt":"For a waived route, record explicit authority, target, reason, and assurance limitation; otherwise leave absent.","required":false,"type":"text"},{"id":"review-summary","max_length":6000,"min_length":1,"multiline":true,"prompt":"Record target, route-specific operation and coverage, backend check, finding evidence, and dispositions without claiming another backend's guarantees.","required":true,"type":"text"},{"id":"completion-assessment-summary","max_length":7000,"min_length":1,"multiline":true,"prompt":"Record each actual requirement by stable criterion identity, responsible owner, met, unmet, unverified, or not-applicable state, and bounded evidence or reference provenance; do not copy full reports or private provider payloads.","required":true,"type":"text"},{"id":"completion-unmet-criteria","minimum":0,"prompt":"Record the number of actual requirements assessed as unmet across all accepted selected-role reports.","required":true,"type":"integer"},{"id":"completion-unverified-criteria","minimum":0,"prompt":"Record the number of actual requirements assessed as unverified across all accepted selected-role reports.","required":true,"type":"integer"},{"id":"reported-severity-summary","max_length":4000,"min_length":1,"multiline":true,"prompt":"Record finding IDs and reviewer-reported severities before local adjudication, or none.","required":true,"type":"text"},{"id":"effective-medium-or-higher-findings","minimum":0,"prompt":"Record the number of valid unresolved findings with effective priority Blocker, Critical, High, or Medium.","required":true,"type":"integer"},{"id":"effective-low-findings","minimum":0,"prompt":"Record the number of valid Low findings that require a completed shared disposition.","required":true,"type":"integer"},{"choices":["consistent","inconsistent"],"id":"finding-count-consistency","prompt":"Record whether unresolved-valid-findings equals the sum of the effective Medium-or-higher and Low finding counts.","required":true,"type":"choice"},{"id":"confirmation-needed-findings","minimum":0,"prompt":"Record the number of findings whose validity still needs confirmation.","required":true,"type":"integer"},{"id":"unresolved-valid-findings","minimum":0,"prompt":"Record the number of unresolved valid findings.","required":true,"type":"integer"},{"id":"unresolved-implementation-findings","minimum":0,"prompt":"Record the native number of unresolved Medium-or-higher findings owned by implementation or refinement; this source fact is descriptive and does not select a rework owner.","required":true,"type":"integer"},{"id":"unresolved-documentation-findings","minimum":0,"prompt":"Record the native number of unresolved Medium-or-higher findings owned by documentation; this source fact is descriptive and does not select a rework owner.","required":true,"type":"integer"},{"id":"implementation-rework-obligations","minimum":0,"prompt":"Record the routing total for backend-check remediation, unresolved implementation or refinement findings, and unmet completion criteria owned by implementation or refinement.","required":true,"type":"integer"},{"id":"documentation-rework-obligations","minimum":0,"prompt":"Record unresolved documentation findings plus unmet completion criteria owned by documentation.","required":true,"type":"integer"},{"id":"verification-rework-obligations","minimum":0,"prompt":"Record unmet completion criteria owned by verification. Assign every unmet criterion to implementation or refinement, verification, or documentation before routing.","required":true,"type":"integer"},{"allowed_media_types":["application/json"],"id":"executor-handoff","prompt":"Reference the complete aquarium.executor-handoff/v3 candidate, exact target, requirement basis, checks, authority, gaps and actual results and available public native handles.","required":true,"type":"artifact"},{"id":"local-correction-count","minimum":0,"prompt":"Record eligible local correction candidates separately from source severity counts; use zero when none apply.","required":true,"type":"integer"},{"accepted_outcomes":["pass","fail","inconclusive"],"id":"local-correction-eligibility","operation_digest":"sha256:c5d1ce604e86d6768f498be4618d6d30935d0b3134ab5290ebbcd0ac82f11c13","operation_id":"aquarium-local-correction-eligibility